,P,,Transitivity,v1,Informal grouping,v2 Scene Role,v2 Prep Function,sent:token ID,v2 decision,
ewtb.r.004574.3:17,out of,,,InitialLocation,,Source,,,,"It is hard to find ... and the mexican food is bland , almost equivalent to eating |out| |of| a can ."
ewtb.r.023620.2:22,out of,,,InitialLocation,,Source,,,,"Even though they still charge you the days you booked but wo n't use , it is worth the get the hell |out| |of| this crap hole ."
ewtb.r.086839.13:17,out of,,,InitialLocation,,Source,,,,"At no time during the conversation did the words , "" I 'm sorry "" ever come |out| |of| his mouth ."
ewtb.r.091704.4:19,out of,,,InitialLocation,,Source,,,,"Turns out the engine had no oil , and when oil was put it , it would just run |out| |of| the filter ."
ewtb.r.148971.11:7,out of,,,InitialLocation,,Source,,,,Just said i was inoperable and walked |out| |of| the hospital room .
ewtb.r.266591.2:7,out of,,,InitialLocation,,Source,,,,The food here is fresh and hot |out| |of| the Wok .
ewtb.r.335815.2:29,out of,,,InitialLocation,,Source,,,,"There are a couple decent people working there , but the rest are VERY dishonest , as well as rude , I have yet to hear the truth come |out| |of| their mouths ."
ewtb.r.221664.4:17,out of the way,,PP,1DTrajectory,out of the way = so as not to obstruct,Source,,,,I asked why so high and they said it was due to the labor of moving things |out| |of| |the| |way| .
ewtb.r.236648.2:4,out ta,,,InitialLocation,be out of (t)here,Source,,,,Walked in and was |out| |ta| there in 10 mins with a really good deal i thought i was going to be paying a lot because i had a DUI but with my DUI and Sr - 22 they were able to get me the best deal out there .
ewtb.r.381455.6:13,out ta,,,InitialLocation,be out of (t)here,Source,,,,"If this is the best that Tucson has to offer , I am |out| |ta| here ..."
ewtb.r.292997.5:12,of,,,Attribute,,Species,,,,"Also , if you are into wine , Alto has the depth |of| both region , varietal , and vintage to satisfy nearly any sommelier ( or after 9 pm , bring your own bottle for free ... no corking fee ! ) ."
ewtb.r.007403.3:12,of,,,Species,,Species,,,,I am a licensed mental health counselor and I work with variety |of| mental health problems .
ewtb.r.015148.2:6,of,,,Species,,Species,,,,Especially high end keep sake sort |of| clothing that you just ca nt find in a lot of stores .
ewtb.r.022533.5:2,of,,,Species,,Species,,,,What kind |of| rude service is that ?
ewtb.r.048201.4:5,of,,,Species,,Species,,,,"We tried 4 different style |of| donuts , they were all the same when it came to quality ."
ewtb.r.054496.1:14,of,,,Species,,Species,,,,I just like the fact that he was able to do the specific type |of| repair I wanted ( a reball ) and give me the longest warranty and even a lower price .
ewtb.r.054798.4:23,of,,,Species,,Species,,,,I 've had 2 cuts now from Georgia and have paid more in other salons / barbershops and have not received this kind |of| treatment or cut !
ewtb.r.055976.7:11,of,,,Species,,Species,,,,Sometimes it is not worth it to go through that kind |of| staff and their personal attitude to get to a doctor .
ewtb.r.058274.3:7,of,,,Species,,Species,,,,"Atmosphere is always fun , the assortment |of| customers adds entertainment to the meal"
ewtb.r.072271.2:19,of,,,Species,,Species,,,,What a joy to stroll off historic Canyon Road in Santa Fe into a gallery with a gorgeous diversity |of| art .
ewtb.r.079375.6:17,of,,,Species,,Species,,,,"In this day it s rare to find such wonderful people who CARE , Not the kind |of| want to make cash ."
ewtb.r.081934.5:2,of,,,Species,,Species,,,,The kind |of| support they provide is simply great !!!
ewtb.r.096340.4:6,of,,,Species,,Species,,,,They do have a good selection |of| fabric and notions .
ewtb.r.100592.1:2,of,,,Species,,Species,,,,"Top range |of| bike , cheap prices , excellent a +++"
ewtb.r.141103.2:10,of,,,Species,,Species,,,,For a hotel like this you would expect some form |of| free internet .
ewtb.r.211797.11:2,of,,,Species,,Species,,,,"Whatever type |of| operation they are running , I 'm not interested and if you 're smart , you wo n't be either ."
ewtb.r.221664.7:7,of,,,Species,,Species,,,,There 's no excuse for that kind |of| estimate .
ewtb.r.223912.5:9,of,,,Species,,Species,,,,Overall they are n't very knowledge about the type |of| games are on the market .
ewtb.r.232157.3:22,of,,,Species,,Species,,,,"It was a great deal -- we paid a certain amount per person , and my husband and I chose 4 types |of| pizza and the servers brought out as much as we wanted ."
ewtb.r.232157.6:11,of,,,Species,,Species,,,,"Even though we were only supposed to have those specific types |of| pizza , when guests asked for a different type , it was brought out with no charge to us !"
ewtb.r.248124.4:12,of,,,Species,,Species,,,,The teachers are highly trained and are expert at handling all types |of| clients .
ewtb.r.269560.3:8,of,,,Species,,Species,,,,It was very upsetting to see this kind |of| behavior especially in front of my four year old .
ewtb.r.279070.4:6,of,,,Species,,Species,,,,"It is a cloth napkin kind |of| place , but I thought well worth it ."
ewtb.r.287454.2:5,of,,,Species,,Species,,,,They offer a large variety |of| quality hotdogs and hamburgers They also offer veggie dogs .
ewtb.r.299148.5:9,of,,,Species,,Species,,,,If you are in town and need that kind |of| space I say stay here but if you are looking for a little more upscale affair do n't let the pictures fool you and book somewhere else .
ewtb.r.311138.3:23,of,,,Species,,Species,,,,"Chasing them on issues from the day I moved in ( many of them still unresolved as I left ) to all sorts |of| farcical issues with funds , after I left . . . . as soon as I could ."
ewtb.r.314880.3:6,of,,,Species,,Species,,,,I get that careless teenager kind |of| treatment from some of their staff ... perhaps they should hire more serious adults to help serve / cook .
ewtb.r.319816.28:17,of,,,Species,,Species,,,,The employees at this Sear's are completely apathetic and there did n't seem to be any sort |of| management that I could see .
ewtb.r.322225.3:5,of,,,Species,,Species,,,,They have a great selection |of| wine from all over the world with all different prices .
ewtb.r.331662.7:2,of,,,Species,,Species,,,,"The selection |of| meats , veggies and sauces is awesome too !"
ewtb.r.339176.3:4,of,,,Species,,Species,,,,"They have all kind |of| coupons available for car washes , oil changes , state inspection , etc ."
ewtb.r.346960.2:18,of,,,Species,,Species,,,,They went the extra mile to repair my cowboy boots -- they had to have a special kind |of| paper that looked like wood grain to fix the heels .
ewtb.r.349020.5:11,of,,,Species,,Species,,,,I admit that I should have paid attention to this kind |of| little things while test drive .
ewtb.r.351058.4:40,of,,,Species,,Species,,,,"i had to call back up there two hours later and the lady ( who claimed to be a manager ) said my food was on the way , and she did nt offer to compensate me in any kind |of| way ."
ewtb.r.366946.3:7,of,,,Species,,Species,,,,"The beers were good , nice choice |of| beers as well , and as usual the mussels were great , the place upstairs is a nice addition to the bar downstairs ."
ewtb.r.369210.5:13,of,,,Species,,Species,,,,Mr. Guerra gave me a better deal without any hassles nor any type |of| problems .
ewtb.r.377347.11:31,of,,,Species,,Species,,,,"By the way , Salmagundi ( the store name ) means something like smorgasbord ; potpourri ; motley ; variety ; mixed bag ; miscellaneous assortment ; mixture , a variety |of| many kinds of things ."
ewtb.r.377347.11:34,of,,,Species,,Species,,,,"By the way , Salmagundi ( the store name ) means something like smorgasbord ; potpourri ; motley ; variety ; mixed bag ; miscellaneous assortment ; mixture , a variety of many kinds |of| things ."
ewtb.r.394662.3:5,of,,,Species,,Species,,,,They had a great selection |of| colors to choose from and their seats are super comfty .
ewtb.r.225861.3:7,from begiinning,,,StartTime,,StartTime,weak MWE,,,yet again it was a great stay |from| |begiinning| to end .
ewtb.r.245160.7:0,from start to finish,,,Duration,,StartTime,weak MWE,,,|from| |start| |to| |finish| they were top notch .
ewtb.r.010820.7:22,from,,,StartTime,,StartTime,,,,I was moving out from 2 bdr apartment and it took for 3 strong guys 6 hours to load a track ( |from| 2 pm - 8 pm ) .
ewtb.r.039383.4:26,from,,,StartTime,,StartTime,,,,"Cons : * Server was n't very pleasant * Pretty small portion on the blackened catfish * Overcooked food * Time , took about 25 minutes |from| ordering to eating ."
ewtb.r.057386.2:5,from,,,StartTime,,StartTime,,,,The one - star review |from| 2005 is out of date .
ewtb.r.122270.2:15,from,,,StartTime,,StartTime,,,,After I had chosen The Fountain Dental Practice they provided a slick and professional service |from| start to finish .
ewtb.r.127252.4:7,from,,,StartTime,,StartTime,,,,Richard Joule and the gang are pros |from| start to finish .
ewtb.r.159371.5:27,from,,,StartTime,,StartTime,,,,i mean a 2 day stay was a ok stay even tho the manager looked like he was chineze and that we only slept and went out |from| 8 to 7 to see New York .
ewtb.r.202402.2:7,from,,,StartTime,,StartTime,,,,"When my server crashed , Greg worked |from| 7 PM until 4 AM and had my company up and running the next morning ."
ewtb.r.225861.2:7,from,,,StartTime,,StartTime,,,,My daughter and I stayed here again |from| the 7th to the 14th of December .
ewtb.r.287454.4:13,from,,,StartTime,,StartTime,,,,The atmosphere is your typical indie outfit with old movie posters and memorabilia |from| the 70's and 80's .
ewtb.r.292997.2:0,From,,,StartTime,,StartTime,,,,"|From| the moment you enter the restaurant , you know you are some place special ."
ewtb.r.311138.3:4,from,,,StartTime,,StartTime,,,,"Chasing them on issues |from| the day I moved in ( many of them still unresolved as I left ) to all sorts of farcical issues with funds , after I left . . . . as soon as I could ."
ewtb.r.319816.14:25,from,,,StartTime,,StartTime,,,,"He said it was the same tire , and verified this , after checking both the actual tire on my car and my service papers |from| earlier in the week ."
ewtb.r.330966.4:34,from,,,StartTime,,StartTime,,,,"I have never considered this a real problem as I travel without kids and can fend for myself , but when I had to listen to a ( non-violent ) domestic fight that lasted |from| 1 AM to 5 AM during my last stay and I found out that the front desk was unmanned during night hours , my choice was to either waste tax payers money by calling for a yet another police dispatch to this hotel , or just get over it ."
ewtb.r.354860.2:0,From,,,StartTime,,StartTime,,,,"|From| first meeting with them to launch of my website , everything went smooth and on schedule ."
ewtb.r.376320.7:0,From,,,StartTime,,StartTime,,,,|From| my first encounter at check in to my regrettable check out I found the staff and facility to exceed my expectation .
ewtb.r.042416.7:38,since,,,StartTime,,StartTime,,,,"We can not wait to go back to Santa Fe and to this great B&B ... especially my 4 year old , who made friends with Ms. Sue and all the ladies , and has talked about them |since| we left !"
ewtb.r.048363.2:11,since,,,StartTime,,StartTime,,,,I was involved in a car accident 20 years ago and |since| then I 've been a nervous wreck and have n't been behind the wheel .
ewtb.r.169083.7:8,since,,,StartTime,,StartTime,,,,This is a great hospital and even better |since| it became part of the UW system .
ewtb.r.171877.3:3,since,,,StartTime,,StartTime,,,,i went there |since| i was four .
ewtb.r.188382.2:9,since,,,StartTime,,StartTime,,,,"I 've been a regular customer at this store |since| it opened , and love the fact that all of the employees are friendly locals ."
ewtb.r.268952.2:5,since,,,StartTime,,StartTime,,,,I have been going there |since| I was a little girl and love the friendly and relaxing atmosphere .
ewtb.r.272836.2:0,Since,,,StartTime,,StartTime,,,,"|Since| moving back from college and trying to settle roots in the Village , I have referred to the La Jolla Blue Book for a ton of local numbers ."
ewtb.r.310032.1:2,since,,,StartTime,,StartTime,,,,Gone downhill |since| change in ownership
ewtb.r.313558.4:11,since,,,StartTime,,StartTime,,,,Neither me nor my son have n't had a single cavity |since| we started dental care there .
ewtb.r.348247.7:11,since,,,StartTime,,StartTime,,,,"They have been my only "" go - to "" resource |since| we first did business together ."
ewtb.r.398243.10:23,since,,,StartTime,,StartTime,,,,"I grew up in a small town where you knew and trusted your mechanic and was really cynical about city auto repair shops |since| I moved here , but Phet has shown that there really are honest hard working mechanics around ."
ewtb.r.018562.5:19,for,,,Explanation,compassionate for,Stimulus,Beneficiary?,,,He is very professional in his position as a director and yet he still made time to be compassionate |for| what we were all going through .
ewtb.r.311138.2:9,for,,,Stimulus,,Stimulus,Beneficiary?,,,"A lack of organisation , coupled with the distain |for| its customers , makes this the worst rental agency I have used ."
ewtb.r.397066.3:7,for,,,Stimulus,,Stimulus,Beneficiary?,,,Lynda is professional and has great compassion |for| animals .
ewtb.r.034813.1:1,by,,,Stimulus,,Stimulus,Causer,,,Baffled |by| the one - star reviews
ewtb.r.114849.1:11,by,,,Stimulus,,Stimulus,Causer,,,"Used their service for the first time and was immediately impressed |by| their professionalism ( received a phone call soon after order was placed to confirm details ) and the subsequent delivery of my gift ( To Split , Croatia ) was as requested ."
ewtb.r.187266.4:15,by,,,Stimulus,,Stimulus,Causer,,,She was dead on -- this restaurant was wonderful --- do not be put off |by| the one negative review on this page .
ewtb.r.275140.1:4,by,,,Stimulus,,Stimulus,Causer,,,I 'm really surprised |by| the negative reviews .
ewtb.r.290594.4:8,by,,,Stimulus,,Stimulus,Causer,,,"I 've toured this place and was impressed |by| how clean the place was , and all the options for the dogs ."
ewtb.r.313825.4:15,by,,,Stimulus,,Stimulus,Causer,,,The manager - Tiffany - is actually very nice so I 'm a bit surprised |by| other comments .
ewtb.r.133981.8:3,of,,,Stimulus,,Stimulus,Causer? ~>Source?,,,Our unit reeks |of| old cigarette smoke and it started to become apparent a few weeks after we moved in .
ewtb.r.326649.5:2,at,,,Goal,look at,Stimulus,Direction,,,I look |at| some of these other comments & laugh because people think that the world revolves around them !
ewtb.r.333672.3:14,at,,,Goal,look at,Stimulus,Direction,,,The sales men were very knowledgeable about every aspect of every car we looked |at| .
ewtb.r.376503.2:37,at,,,Goal,look at,Stimulus,Direction,,,"Liberty construction shows up and it 's two guys ... all I get is 100 % sales pitch "" We 're the best ... we 're number 50 so we must be doing something right ... look |at| all these certificates that say we 're great "" ."
ewtb.r.181771.6:22,for,,,Stimulus,,Stimulus,Direction,,,"We got to talking and he got me set up and I test drove with Craig and I fell head over heels |for| this car all I kept saying , "" was I got ta have it ! """
ewtb.r.043020.8:19,at,,,Stimulus,,Stimulus,Direction?,,,We then called the office and the man we spoke to said he 'd send someone out to look |at| it but could n't promise when - two weeks came and went and we heard nothing .
ewtb.r.079375.2:13,at,,,Stimulus,,Stimulus,Direction?,,,I recently took a rescue puppy to this Clinic and I was SHOCKED |at| how well Romeo and My family was treated .
ewtb.r.101398.2:12,at,,,Stimulus,,Stimulus,Direction?,,,The Bad : I was at Napa recently and was unpleasantly surprised |at| poor waiter svce and subpar food .
ewtb.r.110441.9:2,at,,,Stimulus,,Stimulus,Direction?,,,"After looking |at| the menu and seeing the new menu items they had , we knew we were in for a treat !"
ewtb.r.135800.9:14,at,,,Stimulus,,Stimulus,Direction?,,,"I found out they did not even drive the car , stated they looked |at| it before ."
ewtb.r.181748.6:23,at,,,Stimulus,,Stimulus,Direction?,,,"Essentially , I told him I did n't trust him cause he was a car salesman , but he got so incredibly offended |at| that statement that he had to go cry to another salesman and compose himself before coming back ."
ewtb.r.290594.7:6,at,,,Stimulus,,Stimulus,Direction?,,,Workers who do these introductions look |at| the interaction objectively ; and it 's good to see they are able and willing to say no if they feel there would be a problem .
ewtb.r.319816.2:12,at,,,Stimulus,,Stimulus,Direction?,,,"After happily visiting Sear's Automotives in the past , I was shocked |at| the horrible service received at their Greensboro location ."
ewtb.r.323449.6:8,at,,,Stimulus,,Stimulus,Direction?,,,"I was not impressed , and quite frustrated |at| their lack of rating for their courses ."
ewtb.r.042012.6:8,for,,,Stimulus,,Stimulus,Explanation,,,I will 4 - ever be eternally grateful |for| their hospitality and luv that my Sicilian family showed me when I was there for 3 years .
ewtb.r.270502.5:4,for,,,Stimulus,,Stimulus,Explanation,,,I 'm really thankful |for| the folks at HR Office .
ewtb.r.022273.2:7,to,,,Beneficiary,attentive/attention to,Stimulus,Goal,,,But the servers do n't pay attention |to| you whether it 's busy or not .
ewtb.r.038523.2:1,to,,,Theme,attentive/attention to,Stimulus,Goal,,,Attentive |to| the needs of customer .
ewtb.r.077414.2:5,to,,,Theme,attentive/attention to,Stimulus,Goal,,,"Bloom Legal was really attentive |to| my problem , and Seth Bloom took the time to help me understand the legal issue I was dealing with ."
ewtb.r.135010.8:3,to,,,Theme,attentive/attention to,Stimulus,Goal,,,Pay extra attention |to| the appetizers - the next time I go there I 'm planning on ordered a few instead of an entree .
ewtb.r.349020.5:8,to,,,Theme,attentive/attention to,Stimulus,Goal,,,I admit that I should have paid attention |to| this kind of little things while test drive .
ewtb.r.030126.5:12,to,,,Stimulus,listen to,Stimulus,Goal,,,"The staff and the Principal are rediculous , they do n't listen |to| any input , and they make up rediculous rules ( They banned backpacks , because a teacher TRIPPED OVER a student 's ) ."
ewtb.r.085980.5:30,to,,,Stimulus,listen to,Stimulus,Goal,,,"After our meal , our server found us a table in the jazz club where we were informed it would be another $ 10 / person to stay and listen |to| the band , despite the fact we had just finished a dinner there and were intending to enjoy their drink list ."
ewtb.r.192399.3:1,to,,,Stimulus,listen to,Stimulus,Goal,,,Listened |to| my problem and took care of it .
ewtb.r.206303.4:3,to,,,Stimulus,listen to,Stimulus,Goal,,,"She really listens |to| what it is you would like to achieve , and I am very happy with my results ."
ewtb.r.330966.4:25,to,,,Stimulus,listen to,Stimulus,Goal,,,"I have never considered this a real problem as I travel without kids and can fend for myself , but when I had to listen |to| a ( non-violent ) domestic fight that lasted from 1 AM to 5 AM during my last stay and I found out that the front desk was unmanned during night hours , my choice was to either waste tax payers money by calling for a yet another police dispatch to this hotel , or just get over it ."
ewtb.r.363685.2:9,to,,,Stimulus,listen to,Stimulus,Goal,,,"I called the "" 207 "" number and listened |to| the same recording loop 3 times before I gave up ."
ewtb.r.376503.3:6,to,,,Stimulus,listen to,Stimulus,Goal,,,"Not once did I feel listened |to| like they actually cared about what I wanted , all they were interested in was me signing a contract right then and there ."
ewtb.r.385281.2:26,to,,,Stimulus,listen to,Stimulus,Goal,,,"I 'm 22 , and my hairdresser was great ( and not "" old "" like one of the reviews says ) - she really listened |to| what I wanted and gave me tons of tips on how to style my hair so I could get it to look the way I wanted it to ."
ewtb.r.346627.4:19,to,,,Theme,listen to,Stimulus,Goal,,,We trust and appreciate Scott Larson and know that he will always take good care of us and listen |to| our needs !
ewtb.r.230176.3:4,from,,,Causer,suffer FROM,Stimulus,Source,,,"I have been suffering |from| back pain for over 12 years and have been to numerous specialists , physios , osteos and chiros with no help ."
ewtb.r.268952.4:18,from,,,Causer,suffer FROM,Stimulus,Source,,,I would recommend Bayside Chiropractic to anyone who is in need of a regular adjustment or is suffering |from| a chronic condition .
ewtb.r.170650.4:4,from,,,Causer,,Stimulus,Source,,,My fear and discomfort |from| dental work scared me !
ewtb.r.288930.2:6,of,,,Theme,,Stimulus,Theme,,,"you get a really good view |of| the city and there is also attractions like simulator , short movies ."
ewtb.r.039383.2:14,about,,,Stimulus,,Stimulus,Topic,,,"Pros : * Jill , the owner , is very nice and really cares |about| her feedback * Pretty nice atmosphere * Great Dessert * Not your typical veggie selection , I like !"
ewtb.r.071278.6:9,about,,,Stimulus,,Stimulus,Topic,,,"She is caring , punctual , and very enthusiastic |about| her job !"
ewtb.r.077213.3:5,about,,,Stimulus,,Stimulus,Topic,,,not sure how I feel |about| that one .
ewtb.r.120335.4:28,about,,,Stimulus,,Stimulus,Topic,,,"They offer sales that are n't really sales , mislabeled items that make the item sound like a good deal when it is n't , a bad attitude |about| return items , and on and on ."
ewtb.r.126171.7:6,about,,,Stimulus,,Stimulus,Topic,,,They do n't care one bit |about| you !!!!!
ewtb.r.165143.2:22,about,,,Stimulus,,Stimulus,Topic,,,"First , let me state that although I live in NYC , I am not from NYC , I do n't care |about| baseball and I absolutely love Boston to death ( so beautiful , so clean , so awesome ) ."
ewtb.r.194316.2:34,about,,,Stimulus,,Stimulus,Topic,,,"OMG .. make sure to book a reservation , as this magical place is packed ( in a nice way ) I love that the owner walks around and cares how his customers feel |about| their food ."
ewtb.r.200429.5:5,about,,,Stimulus,,Stimulus,Topic,,,"Seems like all they care |about| is the money and getting home on time , NO care for the customers AT ALL !!!"
ewtb.r.247226.7:14,about,,,Stimulus,,Stimulus,Topic,,,Going there you learn the school does not care about the services given just |about| the money .
ewtb.r.247226.7:9,about,,,Stimulus,,Stimulus,Topic,,,Going there you learn the school does not care |about| the services given just about the money .
ewtb.r.251475.3:25,about,,,Stimulus,,Stimulus,Topic,,,"In a few words ... I 'm pleasantly surprised that you can still find "" old school "" service out there where company care more |about| good name and customers than their pockets ..."
ewtb.r.280663.5:5,about,,,Stimulus,,Stimulus,Topic,,,"We never had to worry |about| a thing , and they led the way the whole time ."
ewtb.r.285133.1:43,about,,,Stimulus,,Stimulus,Topic,,,Hair By Nivine in eastgardens fixed my hair after i had my hair cut and colored at another salon i felt more confident and the girls are fantastic and i ve been going there now for 2 years always happy and they care |about| my hair had my hair done for my wedding it looked fabolous !
ewtb.r.294978.2:12,about,,,Stimulus,,Stimulus,Topic,,,"It 's a fine place , I 'm just a little mystified |about| the Michelin star ."
ewtb.r.315763.6:11,about,,,Stimulus,,Stimulus,Topic,,,I have never had any problems with loud neighbors or concerns |about| safety .
ewtb.r.319816.29:13,about,,,Stimulus,,Stimulus,Topic,,,I will never return there again ( and now have some serious doubts |about| the quality of work they actually performed on my car ) .
ewtb.r.326649.3:8,about,,,Stimulus,,Stimulus,Topic,,,the staff is very personable & actually care |about| the customers safety rather than taking there money .
ewtb.r.332105.3:18,about,,,Stimulus,,Stimulus,Topic,,,"He was prompt , knowledgable , friendly , clean and just an overall great guy who obviously cares |about| his business ."
ewtb.r.363873.7:35,about,,,Stimulus,,Stimulus,Topic,,,"Linda is the rudest person you will ever talk to and she sticks up for all of the trashy , rude people that live there , not the nice ones that actually give a crap |about| respecting others ."
ewtb.r.376503.3:11,about,,,Stimulus,,Stimulus,Topic,,,"Not once did I feel listened to like they actually cared |about| what I wanted , all they were interested in was me signing a contract right then and there ."
ewtb.r.398243.10:18,about,,,Stimulus,,Stimulus,Topic,,,"I grew up in a small town where you knew and trusted your mechanic and was really cynical |about| city auto repair shops since I moved here , but Phet has shown that there really are honest hard working mechanics around ."
ewtb.r.110441.15:25,in,,,Stimulus,take pride in,Stimulus,Topic,,,Bottom line is that when it 's a small privatly owned resturant like this is you can tell that the owners and employees take pride |in| their product and service .
ewtb.r.364454.3:12,in,,,Stimulus,take pride in,Stimulus,Topic,,,"They are professional , knowledgeable , and take meticulous care and pride |in| accomplishing their work ."
ewtb.r.055976.6:6,of,,,Stimulus,,Stimulus,Topic,,,If he does know and approves |of| this behavior then it is a poor reflection on him .
ewtb.r.080221.4:6,of,,,Stimulus,,Stimulus,Topic,,,Each of you should be proud |of| your massive contributions throughout the year !
ewtb.r.122270.6:16,of,,,Stimulus,,Stimulus,Topic,,,"My dental surgeon , Dr. Lucy Nichols is clearly a dental perfectionist and clearly proud both |of| the work she does and the reputation she has established ."
ewtb.r.124163.2:5,of,,,Stimulus,,Stimulus,Topic,,,I had a severe phobia |of| attending the dentist until I met and was treated by Dr Nelson .
