,P,,Transitivity,v1,Informal grouping,v2 Scene Role,v2 Prep Function,sent:token ID,v2 decision,
ewtb.r.358063.2:4,in,,,State,MWE? in pain,Manner,Locus,,,Great place for people |in| chronic pain .
ewtb.r.260640.7:16,in,,,State,MWE? in traffic,Manner,Locus,,,"Whether they pay me or not , if their parents get into an accident , stuck |in| traffic , etc. THE LAST THING I WOULD DO IS LET A CHILD GET RAPED BECAUSE I WAS N'T PAID ."
ewtb.r.133601.6:9,in,,,Manner,,Manner,Locus,,,You are meticulous in your work and it shows |in| my smile .
ewtb.r.121342.10:10,in business,,,State,,Manner,Locus,,,Hopefully they spice things up or they wo nt be |in| |business| long .
ewtb.r.290238.2:7,in business,,,State,,Manner,Locus,,,I think this location is no longer |in| |business| .
ewtb.r.334388.5:5,in business,,,State,,Manner,Locus,,,How do these places stay |in| |business| .
ewtb.r.231203.4:20,in hurry,,,State,,Manner,Locus,,,I think they 're still in the mindset from when it was only smokers sitting around and drinking ... not |in| any |hurry| .
ewtb.r.026883.14:3,in limbo,,,State,,Manner,Locus,,,So I am |in| |limbo| regarding a bedroom suite .
ewtb.r.107692.3:9,in line,,,State,,Manner,Locus,,,"A restaurant with this many patrons willing to stand |in| |line| just to order tacos must be good , right ?"
ewtb.r.314880.1:2,in love,,,State,,Manner,Locus,,,I am |in| |love| with the giant plate of nachos !
ewtb.r.186275.2:7,in need of,,,State,predicate-like,Manner,Locus,,,I will gladly recommend you to anyone |in| |need| |of| or looking for a good florist .
ewtb.r.332068.1:5,in pain,,,State,,Manner,Locus,,,Would not recommend I Was |in| a fair amount of |pain| for several weeks .
ewtb.r.039856.3:8,in person,,,Manner,,Manner,Locus,,,They are very rude over the phone and |in| |person| .
ewtb.r.248027.4:24,in person,,,Manner,,Manner,Locus,,,"Tonight , I called several times with no answer ( Btwn 5:30 and 6 pm ) and finally drove there to place my order |in| |person| ."
ewtb.r.235211.5:22,in search of,,,Manner,predicate-like,Manner,Locus,,,We have had many conversations with them and they have always been extremely patient with me as I tried on multiple hats |in| |search| |of| the right costumes for my magic act .
ewtb.r.252791.1:2,in stock,,,State,,Manner,Locus,,,no feathers |in| |stock| !!!!
ewtb.r.319816.11:18,in stock,,,State,,Manner,Locus,,,"I would not have gone back , but I could n't find the particular tire they 'd used |in| |stock| anywhere else ."
ewtb.r.319816.16:21,in stock,,,State,,Manner,Locus,,,"So I pointed this out to him , at which point he said they only had one of the correct tires |in| |stock| ."
ewtb.r.343813.3:11,in stock,,,State,,Manner,Locus,,,Travelled 40 mins after calling to see if a product was |in| |stock| .
ewtb.r.207629.5:15,in the best interests,,,State,,Manner,Locus,,,I ca nt speak for them but any tests or appointments they recommend are probably |in| |the| |best| |interests| of us ( the patient ) and you have the ability to decline anything that they suggest to you .
ewtb.r.162422.3:21,in the middle of,,,State,,Manner,Locus,,,"When we walked in , the person behind desk said : "" oh well , you must wait , I am |in| |the| |middle| |of| something . """
ewtb.r.272836.3:7,in touch,,,State,predicate-like,Manner,Locus,,,The white pages allowed me to get |in| |touch| with parents of my high school friends so that I could track people down one by one and the restaurant section is basically my cookbook .
ewtb.r.313714.5:4,in traffic,,,State,,Manner,Locus,,,If you get caught |in| |traffic| and are a couple minutes late they make you re-schedule ... for 6 weeks later .
ewtb.r.148971.5:17,on,,,State,ventilator,Manner,Locus,,,"Then he renigged when he read my Health Care Proxy , even though i agreed to be |on| the ventilator for 2 months following surgery ( as he had twice stated i must agree to ) ."
ewtb.r.148971.8:13,on,,,State,ventilator,Manner,Locus,,,"He did not even give me the chance to say i would stay |on| the ventilator longer , which i would have ."
ewtb.r.148012.3:4,on a budget,,,State,,Manner,Locus,,,Perfect since I 'm |on| |a| |budget| .
ewtb.r.159371.1:6,on a budget,,,State,,Manner,Locus,,,ok but just becuse we where |on| |a| tight |budget| .
ewtb.r.275919.12:0,On call,,,State,,Manner,Locus,,,"|On| |call| , it takes a day to get our issues resolved ."
ewtb.r.266591.3:9,on duty,,,Activity,,Manner,Locus,,,The food is cooked fast by the two chefs |on| |duty| .
ewtb.r.158335.4:6,on duty,,,State,,Manner,Locus,,,I asked if a manager was |on| |duty| he told me he was .
ewtb.r.036753.8:7,on hold,,,State,,Manner,Locus,,,I called and got the same runaround |on| |hold| and noone calls you back .
ewtb.r.354860.2:15,on schedule,,,Manner,,Manner,Locus,,,"From first meeting with them to launch of my website , everything went smooth and |on| |schedule| ."
ewtb.r.038358.4:9,on the cheap,,,Manner,,Manner,Locus,,,Comfort zone came out and did my house heat |on| |the| |cheap| .
ewtb.r.105518.4:3,on the lookout,,,State,,Manner,Locus,,,If you are |on| |the| |lookout| for a pure breed pup do n't forget to check out the shelters !
ewtb.r.223912.5:12,on the market,,,State,,Manner,Locus,,,Overall they are n't very knowledge about the type of games are |on| |the| |market| .
ewtb.r.313714.3:5,on the phone,,,State,,Manner,Locus,,,You NEVER get a human |on| |the| |phone| .
ewtb.r.093655.3:42,on the side,,,State,on the ADJ side,Manner,Locus,,,"In the past , I got a steak and there was more fat and rough pieces than there was good steak ( and this was the sirloin ! ) , the sides were drenched with butter and the salad was a little |on| |the| brown |side| ."
ewtb.r.153921.4:5,on the side,,,State,on the ADJ side,Manner,Locus,,,It can be a little |on| |the| spicy |side| but just ask them exactly what you want and they are very helpful .
ewtb.r.084373.4:2,on time,,,Manner,,Manner,Locus,,,They came |on| |time| and completed their work quickly .
ewtb.r.182354.3:10,on time,,,State,,Manner,Locus,,,"They were very professional , respectful , completed the Job |on| |time| , and well below my budget ."
ewtb.r.200429.5:12,on time,,,State,,Manner,Locus,,,"Seems like all they care about is the money and getting home |on| |time| , NO care for the customers AT ALL !!!"
ewtb.r.337971.3:8,on time,,,State,,Manner,Locus,,,They have unbeatable price in town and deliver |on| |time| .
ewtb.r.341397.3:3,on time,,,State,,Manner,Locus,,,"the guy came |on| |time| and did n't take any breaks , he went straight to work and finished the job efficiently and promptly !"
ewtb.r.376320.3:29,on time,,,State,,Manner,Locus,,,I work for a large retail company recently expanding our operations into Canada and had to travel to ensure all of our computer network equipment was installed properly and |on| |time| .
ewtb.r.010393.2:8,on time,,,Time,,Manner,Locus,,,The first time I used them they arrived |on| |time| and towed car for me to the destination I needed .
ewtb.r.011257.4:6,on time,,,Time,,Manner,Locus,,,I said great and Dan arrived |on| |time| at 10 am to make the repair .
ewtb.r.182354.4:15,on time,,,Time,,Manner,Locus,,,"Mike one of owners was awesome , he explained the detailed plan , and executed |on| |time| , I am always going use them and refer them to many friends I can because of the great job they did me ."
ewtb.r.125522.1:2,out of business,,,State,,Manner,Locus,,,They are |out| |of| |business| .
ewtb.r.290238.1:0,Out of business,,,State,,Manner,Locus,,,|Out| |of| |business| ?
ewtb.r.247097.3:8,out of control,,,State,,Manner,Locus,,,"Before treatment , my food cravings were "" |out| |of| |control| "" which caused me to be stressed out ."
ewtb.r.057386.2:8,out of date,,,State,,Manner,Locus,,,The one - star review from 2005 is |out| |of| |date| .
ewtb.r.333243.6:32,out of the ordinary,,,State,,Manner,Locus,,,"Asked why , Rod simply told me that he had to research how to do the amendment ( it was an amended to show that I had purchased a home - nothing |out| |of| |the| |ordinary| , one would think ) and that took time to figure out ."
ewtb.r.117115.9:43,under,,,State,,Manner,Locus,,,"I called Home - Excel the next day to order a replacement screen for the window , and was happily surprised when they said that they were n't even going to charge me for the replacement screen ... that it would be covered |under| their guarentee ."
ewtb.r.349020.8:7,under warranty,,,State,,Manner,Locus,,,They told me that this is not |under| |warranty| and want to charge me $ 175 just to diagnose the problem !
ewtb.r.202402.2:17,up and running,,,State,,Manner,Locus,,,"When my server crashed , Greg worked from 7 PM until 4 AM and had my company |up| |and| |running| the next morning ."
ewtb.r.369087.4:8,up and running,,,State,,Manner,Locus,,,They squeezed me in and had me back |up| |and| |running| in no time .
ewtb.r.369087.7:4,up to date,,,State,,Manner,Locus,,,The advisor kept me |up| |to| |date| and informed on the progress of my vehicle .
ewtb.r.122882.3:12,up to par,,,State,,Manner,Locus,,,"The atmosphere alone deserves 4 stars but , the food was not |up| |to| |par| with the price tag and the reputation the restaurant carries ."
ewtb.r.268952.4:9,in need,,,State,predicate-like,Manner,Locus; MWE: in_need_of,,,I would recommend Bayside Chiropractic to anyone who is |in| |need| of a regular adjustment or is suffering from a chronic condition .
ewtb.r.165032.2:15,in the light,,,Manner,,Manner,"not MWE, or ‘the’ not part of MWE",,,We went through six photographers to find the right photographers that would represent our firm |in| |the| |light| we wished to and Michael and his team made that happen .
ewtb.r.018465.1:3,from Hell,,,Source,FROM hell,Manner,Source,,,The Salon Experience |from| |Hell|
ewtb.r.018465.16:5,from Hell,,,Source,FROM hell,Manner,Source,,,It was the salon experience |from| absolutely |Hell| .
ewtb.r.018465.3:1,out of,,,StartState,be out of college,Manner,Source,,,Right |out| |of| college I called the salon and explained my situation .
ewtb.r.251475.3:0,In,,,Manner,in _ words,Manner,,,,"|In| a few words ... I 'm pleasantly surprised that you can still find "" old school "" service out there where company care more about good name and customers than their pockets ..."
ewtb.r.071650.9:41,in,,,Manner,in + manner,Manner,,,,I was able to cancel it but only after paying a $ 50 fee ( which the staff person who signed me up stated I would not have to pay if I had proof of moving ) and being spoken to |in| a very belittling manner .
ewtb.r.326649.4:24,in,,,Manner,in + manner,Manner,,,,This is however a very busy shop but there are appointments available & the staff up front will surely make sure you get back |in| a timely manner .
ewtb.r.369210.1:23,in,,,Manner,in + manner,Manner,,,,"When I arrived at Brickell Honda on 6/4/11 , I was greeted and attended to by the Sales Manager , Gustavo Guerra , |in| a very friendly and professional manner ."
ewtb.r.094189.6:9,in,,,Manner,in + way,Manner,,,,This place is the opposite of QuikTrip : crappy |in| every way .
ewtb.r.156953.9:20,in,,,Manner,in + way,Manner,,,,But she did a fabulous job letting me know what she was doing at all times and styled my hair |in| a way i could do it at home .
ewtb.r.194316.2:16,in,,,Manner,in + way,Manner,,,,"OMG .. make sure to book a reservation , as this magical place is packed ( |in| a nice way ) I love that the owner walks around and cares how his customers feel about their food ."
ewtb.r.275919.7:7,in,,,Manner,in + way,Manner,,,,FusionRetail helps us to maintain the store |in| an organised way .
ewtb.r.351058.4:37,in,,,Manner,in + way,Manner,,,,"i had to call back up there two hours later and the lady ( who claimed to be a manager ) said my food was on the way , and she did nt offer to compensate me |in| any kind of way ."
ewtb.r.374604.2:5,in,,,Manner,in + way,Manner,,,,If the animals are treated |in| the same way the customers are treated then this leaves a lot to be desired !
ewtb.r.118718.5:5,in detail,,,Extent,,Manner,,,,Dr. Wallen explained the procedure |in| |detail| and took his time with me .
ewtb.r.062167.4:14,in the midst of,,,State,"~undergoing, experiencing an event",Manner,,,,I found her through a colleague one day when one of my clients was |in| |the| |midst| |of| a panic attack and needed professional help that I am not qualified to provide .
ewtb.r.371300.5:7,to go,,,Manner,,Manner,,,,I was told to take my coffee |to| |go| if I wanted to finish it .
ewtb.r.156953.7:10,with,,,Circumstance,depictive,Manner,,,,It was the first time i had left a salon |with| my hair curly .
ewtb.r.345182.15:0,With,,,Circumstance,depictive,Manner,,,,|With| a smirk on her face she told me NO MONEY IS BEING RETURNED and THAT IS THE WAY IT WAS .
ewtb.r.163250.3:4,with,,,Circumstance,,Manner,,,,It was all sorted |with| no hassle at all and I 'm really grateful - they were fab .
ewtb.r.232157.6:26,with,,,Circumstance,,Manner,,,,"Even though we were only supposed to have those specific types of pizza , when guests asked for a different type , it was brought out |with| no charge to us !"
ewtb.r.319816.25:42,with,,,Circumstance,,Manner,,,,"Of course , they could n't call him either to ask about it because apparently they do n't keep their employees ' phone numbers ( riiight ) , so I would have to return on Monday ( driving for 3 days now |with| no wheel lock should I get a flat ) ."
ewtb.r.363482.2:7,with,,,Circumstance,,Manner,,,,"How do you run a cafe , |with| no refills on coffee - ?"
ewtb.r.004940.5:3,with,,,Manner,,Manner,,,,They did that |with| no problem .
ewtb.r.072507.4:31,with,,,Manner,,Manner,,,,"In just 2 - 3 focused lessons , I 'm already now capable of picking up new songs off YouTube guitar how to videos and am even writing my own orginals |with| confidence !"
ewtb.r.101972.8:11,with,,,Manner,,Manner,,,,"I had to ask the greeter , he explained his reasons |with| broken English ."
ewtb.r.130647.3:8,with,,,Manner,,Manner,,,,The workers sped up and down the street |with| no mind to the small children playing .
ewtb.r.171255.2:4,with,,,Manner,,Manner,,,,They treat there employees |with| respect and concern and expect that they will extend the same politeness to there customers .
ewtb.r.181748.10:10,with,,,Manner,,Manner,,,,"For instance I asked who owned Mazda and he said |with| confidence that was GM , which is n't true ."
ewtb.r.235576.5:16,with,,,Manner,,Manner,,,,Family owned and operated makes sure the atmosphere is relaxed and the food home - cooked |with| style .
ewtb.r.340848.8:8,with,,,Manner,,Manner,,,,A short but wide - ranging menu executed |with| innovative perfection in a cozy hole in the wall just off the main street .
ewtb.r.361316.4:10,with,,,Manner,,Manner,,,,Once they fixed it they answetred all of my questions |with| no hesitations and then gave me the best quote ever .
ewtb.r.398152.4:17,with flying colors,,,Manner,,Manner,,,,"Ten minutes later , I took my car down the street and it passed the emissions test |with| |flying| |colors| ."
ewtb.r.145645.2:18,without,,,Attribute,,Manner,,,,can ever & never forget the training undergone here which made my life step onto the successful job |without| any hurdles .
ewtb.r.369210.5:7,without,,,Attribute,,Manner,,,,Mr. Guerra gave me a better deal |without| any hassles nor any type of problems .
ewtb.r.101972.6:21,without,,,Manner,,Manner,,,,"However , we waited and waited and in the mean time , saw 4 groups of people simply just paraded in |without| signing there names ."
ewtb.r.128636.3:10,without,,,Manner,,Manner,,,,He is willing to do whatever you need from him |without| hesitation .
ewtb.r.243799.3:9,without,,,Manner,,Manner,,,,she did nt even let me finish a sentence |without| insulting me and telling me how i should have said it !
ewtb.r.311987.6:16,without,,,Manner,,Manner,,,,So they were going to charge him for new peddles and proceeded to put them on |without| even telling him the price .
ewtb.r.340848.9:3,without,,,Manner,,Manner,,,,"Fantastic food served |without| pretense , very reasonably priced wine selections ."
ewtb.r.234261.8:1,AT ALL COSTS,,,Extent,,Manner?,,,,AVOID |AT| |ALL| |COSTS| .
ewtb.r.116821.8:13,by,,,Value,rate?,Manner?,,,,"I knew I had found the real deal , big pies , sold |by| the slice , with the pizzas sitting under the glass in the front ."
ewtb.r.262441.1:40,over,,,Duration,,Means,Duration? Circumstance? Path?,,,"I phoned this company for advice on our office refurb and although we did not use them in the end ( as our building contractor carried out the electrical work ) , they provided me with plenty of useful information |over| an hour phone call and subsequently we are now using PJC as our electrical maintenance contractor ."
ewtb.r.010378.6:11,by,,,Means,,Means,,,,I think he could 've done more to assuage my concerns |by| giving me concrete facts .
ewtb.r.059088.2:4,by,,,Means,,Means,,,,Encino has been blessed |by| the opening of this smoke shop most definately .
ewtb.r.128168.2:5,by,,,Means,,Means,,,,"First let me start out |by| saying , that I have had very nice pedicures at Lovely Nails on Military Road ."
ewtb.r.148971.14:27,by,,,Means,,Means,,,,"I , along with my friends , consider this doctor to be the cause of my death as he is not even trying to save my life |by| operating ."
ewtb.r.211797.4:23,by,,,Means,,Means,,,,I thought it would be a good idea to see how a few that I liked would look like on a model ( |by| looking the dress up online ) .
ewtb.r.310032.7:7,by,,,Means,,Means,,,,To date they have not made good |by| either finding the key or paying for a new one .
ewtb.r.330966.4:67,by,,,Means,,Means,,,,"I have never considered this a real problem as I travel without kids and can fend for myself , but when I had to listen to a ( non-violent ) domestic fight that lasted from 1 AM to 5 AM during my last stay and I found out that the front desk was unmanned during night hours , my choice was to either waste tax payers money |by| calling for a yet another police dispatch to this hotel , or just get over it ."
ewtb.r.337971.2:10,by,,,Means,,Means,,,,"Fresh Design Studio helped jump - start my own business |by| providing affordable and effective marketing materials : logo , flyers , posters ad design , and more ."
ewtb.r.354336.3:11,by,,,Means,,Means,,,,"Try their weekend "" tastings "" which you can learn about |by| getting on their weekly email list ."
ewtb.r.363685.13:23,by,,,Means,,Means,,,,Rules in the room : # 1 ) if you drink the soda from the fridge in your room you must prove it |by| leaving the can in the trash .
ewtb.r.055207.3:6,through,,,Means,,Means,,,,"But I had my cat spayed |through| their reduced / free spay and neuter program and the vet they sent us to was first of all a hour and a half away , and 4 days later we had to bring them to our normal vet because the vets at the place in wisconsin did a crappy job and they got infections ."
ewtb.r.267982.1:8,through,,,Means,,Means,,,,I won a golf lesson certificate with Adz |through| a charity auction .
ewtb.r.180886.6:9,with,,,Attribute,,Means,,,,He really made the visit a pain free one |with| excellent service !
ewtb.r.025894.3:17,with,,,Means,,Means,,,,One time we even left after sitting at the table for 20 minutes and not being greeted |with| a drink order .
ewtb.r.120335.2:9,with,,,Means,,Means,,,,This store is proof that you can fool people |with| good advertising .
ewtb.r.275919.8:9,with,,,Means,,Means,,,,"Usage of product barcodes and smooth maintenance of inventory |with| proper recording of transactions like sale , purchase and returns was never easy before ."
ewtb.r.247097.9:6,more like,,,Comparison/Contrast,,MORE LIKE,ComparisonRef,,,"It hurt very little , felt |more| |like| pressure than pain ."
ewtb.r.269560.1:43,more like,,,Comparison/Contrast,,MORE LIKE,ComparisonRef,,,Was there this past weekend and the guy behind the counter yelled at me and my son because we believed he left the grandma slice in the oven a little too long and the cheese got all dried out and the slice tasted |more| |like| a cracker .
ewtb.r.196219.2:10,OF,MORE_OF,,Comparison/Contrast,more of = more like,MORE_OF,`d,,,"IT IS NOT A HIGH END STEAK HOUSE , MORE |OF| THE CUISINE BRETT ENJOYS IN MISSISSIPPI ."
ewtb.r.030875.3:16,to,,,Experiencer,home to,MWE: home_to,,,,"Their location , the northwest corner of S. 10th & Federal Sts. , is now home |to| Slice Pizza ."
ewtb.r.396880.3:8,to,,,Theme,treat to,MWE: treat_to,,,,"We got there , and we were treated |to| the free "" upgrade "" of a room with two double beds ."
ewtb.r.361348.7:3,like,,,Comparison/Contrast,NothingLike,NOTHING_LIKE?,,,,This was nothing |like| New York style pizza !!!.
ewtb.r.382073.3:14,of,OFF_OF,,Location,,OFF_OF,,,,"It 's located in the huge HONKA Log Homes building , by Walmart off |of| Evergreen Parkway ."
ewtb.r.192399.1:1,with,,,ProfessionalAspect,EmployerAsAccompanier,OrgRole,Accompanier,,,Kyle |with| Bullwark
ewtb.r.007403.7:5,with,,,ProfessionalAspect,RelRoleAccompanier,OrgRole,Accompanier,,,I am a preferred provider |with| most insurance companies .
ewtb.r.384229.2:2,with,,,ProfessionalAspect,RelRoleAccompanier,OrgRole,Accompanier,,,I was |with| verizon and I checked my service with tmobile and it was great so I thought I would try tmobile .
ewtb.r.010393.3:5,for,,,ProfessionalAspect,EmployerAsBeneficiary,OrgRole,Beneficiary,,,The auto mechanics that work |for| Auto Towing are very friendly and informative and answered any question I had .
ewtb.r.280663.9:16,for,,,ProfessionalAspect,EmployerAsBeneficiary,OrgRole,Beneficiary,,,"I am a music junkie that grew up in the 80's , and my dad worked |for| a record label in the 1960's ."
ewtb.r.361545.1:6,for,,,ProfessionalAspect,EmployerAsBeneficiary,OrgRole,Beneficiary,,,One suspects that earlier reviewer works |for| another laundry .
ewtb.r.376320.3:2,for,,,ProfessionalAspect,EmployerAsBeneficiary,OrgRole,Beneficiary,,,I work |for| a large retail company recently expanding our operations into Canada and had to travel to ensure all of our computer network equipment was installed properly and on time .
ewtb.r.077298.2:9,with,,,Attribute,,OrgRole,Characteristic,,,I 'm not interested in shopping in a place |with| people like her ... she refused to sell me the item at its marked price even after admitting they had made a mistake .
ewtb.r.117115.12:14,with,,,Attribute,,OrgRole,Characteristic,,,"In this day and age , it is so rare to find a company |with| such nice workers and such far ranging guarantee policies ."
ewtb.r.118770.1:7,with,,,Attribute,,OrgRole,Characteristic,,,This place is clean and well run |with| great people .
ewtb.r.188548.12:9,with,,,Attribute,,OrgRole,Characteristic,,,There are other places with food just as good |with| management that values customers and employees much more .
ewtb.r.324337.6:9,with,,,Attribute,,OrgRole,Characteristic,,,I prefer Advanced auto parts over this crappy place |with| the meanest people .
ewtb.r.367586.1:3,with,,,Attribute,,OrgRole,Characteristic,,,Well kept facility |with| friendly staff .
ewtb.r.039856.6:5,with,,,ProfessionalAspect,RelRoleCoagent,OrgRole,Co-Agent,,,I will NEVER do business |with| Sun Toyota again .
ewtb.r.267982.1:6,with,,,ProfessionalAspect,RelRoleCoagent,OrgRole,Co-Agent,,,I won a golf lesson certificate |with| Adz through a charity auction .
ewtb.r.278775.8:5,with,,,ProfessionalAspect,RelRoleCoagent,OrgRole,Co-Agent,,,"Well we have been working |with| Ulistic for 1.5 months , and have 100 people following our site on Facebook , and our web site , www.designofashion.com has seen a 3 fold increase in traffic , which is significantly beating our expectations - SEO is a process that takes time and to get results this quickly is exceptional ."
ewtb.r.310032.5:14,with,,,ProfessionalAspect,RelRoleCoagent,OrgRole,Co-Agent,,,"I am waiting longer at BNA for my pickups and last time I parked |with| them , they lost my car key ."
ewtb.r.337971.4:3,with,,,ProfessionalAspect,RelRoleCoagent,OrgRole,Co-Agent,,,I enjoy working |with| this architectural and graphic design firm and will recommend to anyone .
ewtb.r.355325.2:7,to,,,Destination,go to college,OrgRole,Goal,,,"I came to La Crosse to go |to| college , and my mom would send me birthday flowers though here ."
ewtb.r.356920.5:3,to,,,Destination,go to dental practice,OrgRole,Goal,,,Do n't go |to| Amelia Gentle Dentistry .
ewtb.r.116821.2:10,to,,,Destination,"go-to (attend, belong)",OrgRole,Goal,,,"Ok I am a New Yorker who has been going |to| school in Oxford , England ."
ewtb.r.225632.7:6,to,,,Destination,,OrgRole,Goal,,,"If I remember , students went |to| Dartmouth , U. Penn , Duke , BU , William and Mary , Vassar , Howard , and Carnegie Mellon , among others ."
ewtb.r.225632.8:3,to,,,Destination,,OrgRole,Goal,,,"Many students went |to| Rutgers , including their top - ranked pharmacy program ."
ewtb.r.247226.2:1,to,,,Destination,,OrgRole,Goal,,,Went |to| the school here OVER PRICED !!!!!!
ewtb.r.024132.2:1,at,,,ProfessionalAspect,EmployerAsLocation,OrgRole,Locus,,,"Mark |at| Tintman Nationwide tints Ltd , did a very Professional job very quick , no fuss , deliverd the car to me and I drove him back home , Great arrangement Great price !!"
ewtb.r.059655.1:2,at,,,ProfessionalAspect,EmployerAsLocation,OrgRole,Locus,,,the team |at| barton car wash was very friendly .
ewtb.r.071518.5:13,at,,,ProfessionalAspect,EmployerAsLocation,OrgRole,Locus,,,I was so impressed with the honesty and integrity of Mike and everyone |at| Eagle Transmission !
ewtb.r.095040.2:14,at,,,ProfessionalAspect,EmployerAsLocation,OrgRole,Locus,,,"As first - time home buyers , my husband and I found Stephanie Fairchild |at| Prudential Steamboat Realty , extremely helpful ."
ewtb.r.107608.2:13,at,,,ProfessionalAspect,EmployerAsLocation,OrgRole,Locus,,,I v just had my bmw z3 rear window replaced by the guys |at| kelvin trimmers .
