,P,,Transitivity,v1,Informal grouping,v2 Scene Role,v2 Prep Function,sent:token ID,v2 decision,
ewtb.r.121651.2:6,for,,,Reciprocation,,Explanation,,,,We would like to thank you |for| the roofing job you did on our home .
ewtb.r.133260.2:1,for,,,Reciprocation,,Explanation,,,,Thanks |for| fixing my garage door A ++++++++++++++++++
ewtb.r.133601.5:2,for,,,Reciprocation,,Explanation,,,,Thank you |for| helping to preserve my teeth .
ewtb.r.163703.1:5,for,,,Reciprocation,,Explanation,,,,Cheap Hotel Rome - Thanks |for| all your help !
ewtb.r.163703.2:5,for,,,Reciprocation,,Explanation,,,,Cheap Hotel Rome - thanks |for| finding us a hotel at the last minute .
ewtb.r.164805.13:1,for,,,Reciprocation,,Explanation,,,,Thanks |for| the great deal and the great car !
ewtb.r.178726.7:1,for,,,Reciprocation,,Explanation,,,,Thanks |for| the great care !!!!
ewtb.r.188548.8:1,for,,,Reciprocation,,Explanation,,,,Sorry |for| interrupting I guess .
ewtb.r.217747.2:5,for,,,Reciprocation,,Explanation,,,,Thank you so much |for| the superior job well done .
ewtb.r.232157.7:5,for,,,Reciprocation,,Explanation,,,,I really appreciate BJ s |for| making that special day even better with their wonderful food and service .
ewtb.r.251774.1:2,for,,,Reciprocation,,Explanation,,,,Thank you |for| helping me get more healthy !
ewtb.r.251774.6:10,for,,,Reciprocation,,Explanation,,,,"Dr. Ruona , if you read this , thank you |for| helping me get more healthy ."
ewtb.r.266676.1:1,For,,,Reciprocation,,Explanation,,,,Thanks |For| A Great Job
ewtb.r.266676.2:1,For,,,Reciprocation,,Explanation,,,,"Thanks |For| The Prompt Service And Great Job You And Your Boys Have Done On Our New Solar System , The Panels On The Roof Look Great And The Power We Are Putting Back In To The Grid Is Great , Great Job Thanks"
ewtb.r.295288.7:24,for,,,Reciprocation,,Explanation,,,,"So yes , I would n't hesitate in recommending the team at Just Autos for easy professional car repairs , Thank you Just Autos |for| your help ."
ewtb.r.332785.1:1,for,,,Reciprocation,,Explanation,,,,Thanks |for| following me around the store
ewtb.r.346627.5:3,for,,,Reciprocation,,Explanation,,,,Thank you again |for| great customer service !
ewtb.r.363428.4:8,for,,,Reciprocation,,Explanation,,,,"Nothing too much trouble for Ian , thanks |for| a great stay ."
ewtb.r.376320.11:9,for,,,Reciprocation,,Explanation,,,,Please pass my appreciation to the Staff and Management |for| their excellent hospitality and good spirits as it helped make a stressful trip enjoyable .
ewtb.r.380048.6:3,for,,,Reciprocation,,Explanation,,,,Thank - You |for| sharing your cottage !
ewtb.r.024385.5:9,since,,,Explanation,,Explanation,,,,I 'm assuming they are completely out of business |since| I ca n't find any contact information .
ewtb.r.048363.11:4,since,,,Explanation,,Explanation,,,,"Gerry pleasantly said "" |since| I am already here why do n't we give it shot ."
ewtb.r.062167.3:0,Since,,,Explanation,,Explanation,,,,|Since| this is an alternative therapy I always refer clients to a lisenced therapist when I feel that is appropriate .
ewtb.r.071650.7:26,since,,,Explanation,,Explanation,,,,Back to my poor rating - I was excepted to medical school and went in to cancel my membership as I was told I could do |since| I was moving away .
ewtb.r.095523.4:0,Since,,,Explanation,,Explanation,,,,|Since| I 'm usually at work late Deb has stayed around to help me out when needed .
ewtb.r.101398.6:11,since,,,Explanation,,Explanation,,,,If you must go ask lots of questions about your selections |since| your expectations may as high as mine were .
ewtb.r.118679.1:7,since,,,Explanation,,Explanation,,,,I really want to like this place |since| I work right around the corner .
ewtb.r.148012.3:1,since,,,Explanation,,Explanation,,,,Perfect |since| I 'm on a budget .
ewtb.r.198455.2:11,since,,,Explanation,,Explanation,,,,"I had a dead battery last week and called this company |since| they were the closest they had very quick service for a Monday morning , thanks again guys ."
ewtb.r.209465.6:4,since,,,Explanation,,Explanation,,,,remember to bring cash |since| they do n't take debit or credit .
ewtb.r.211797.14:2,since,,,Explanation,,Explanation,,,,"Somehow , |since| she supposedly does n't know any names of designers / dresses , after I told her the designer and dress name of the one I was comparing , she knew "" exactly which dress "" I was referring to and disagreed with my observation ; she said that the bodice did come as low as the one I had on ."
ewtb.r.211797.7:18,since,,,Explanation,,Explanation,,,,"Hmmm ... A person can not call a company , if you have no idea its name ( |since| the designer is unknown ... SUPPOSEDLY ) , and order a gown without a dress name or style number ."
ewtb.r.317846.2:8,since,,,Explanation,,Explanation,,,,I used to go here almost every day |since| I work in the neighbourhood and loved their turkey and meatball sandwiches .
ewtb.r.319816.7:14,since,,,Explanation,,Explanation,,,,I had wanted to split the total between a credit card and check card |since| I was being reimbursed for the tire but was told this was n't possible .
ewtb.r.345182.13:14,since,,,Explanation,,Explanation,,,,She told me that was to bad she would do nothing to help me |since| she could not use or resell the piece .
ewtb.r.345182.7:13,since,,,Explanation,,Explanation,,,,I took the original piece of metal and rigged it to make due |since| I had to complete the job .
ewtb.r.396880.4:0,Since,,,Explanation,,Explanation,,,,"|Since| they consider this an upgrade , they let their other rooms fill up and would not change our room ."
ewtb.r.130216.2:7,thanks to,,,Explanation,,Explanation,,,,My house already feels fresh and good |thanks| |to| the Battery Park Pest I 'm enjoying my time indoors much better .
ewtb.r.148971.13:13,thanks to,,,Explanation,,Explanation,,,,"I am just middle aged and do not want to die , but |thanks| |to| this doctor i have no other alternatives ."
ewtb.r.192713.8:7,thanks to,,,Explanation,,Explanation,,,,"It put hair on my chest and |thanks| |to| the owner s advice I invested vanguard , got myself a woman like Jerry , and became a republican ."
ewtb.r.054269.2:20,of,,,Value,,Extent,Identity?,,,"Compact 's Corona dryers remove at least twice as much water as the previous dryers , allowing a production increase |of| over 10 % and a significant energy saving ."
ewtb.r.029230.5:11,at all,,,Extent,,Extent,,,,"They also have the best tea I ever had , not |at| |all| like the junk you get at the grocery stores , I stock up when ever there because they are closed in the winter ."
ewtb.r.053248.23:13,at all,,,Extent,,Extent,,,,"Did they think we were going to feel lucky to get any reservation |at| |all| , and therefore be more pleased with our dining experience ?"
ewtb.r.070730.4:5,at all,,,Extent,,Extent,,,,"The other rolls were n't |at| |all| special , especially given their pricing ."
ewtb.r.107692.6:21,at all,,,Extent,,Extent,,,,"The staff taking your order and "" waiting "" on you are very indifferent and have no sense of costumer service |at| |all| ."
ewtb.r.150192.3:12,at all,,,Extent,,Extent,,,,The sauce was dry and the enchiladas did not taste good . |at| |all| .
ewtb.r.163250.3:7,at all,,,Extent,,Extent,,,,It was all sorted with no hassle |at| |all| and I 'm really grateful - they were fab .
ewtb.r.200429.5:20,AT ALL,,,Extent,,Extent,,,,"Seems like all they care about is the money and getting home on time , NO care for the customers |AT| |ALL| !!!"
ewtb.r.247226.9:14,AT ALL,,,Extent,,Extent,,,,Beware of the nail program you are not taught to use a nail drill |AT| |ALL| you learn the old fashioned way of doing nails you will not be able to do well in a salon !!!
ewtb.r.322225.4:22,at all,,,Extent,,Extent,,,,"The employees make you feel very comfortable and are very helpful , whether you are very knowledgeable or do n't know anything |at| |all| about wine ."
ewtb.r.077213.1:4,at best,,,Extent,,Extent,,,,the food is mediocre |at| |best| .
ewtb.r.120335.3:21,at best,,,Extent,,Extent,,,,"They convince lots of people that they are a great store , when in fact they are a very average place |at| |best| , they are just another big box store like the others ."
ewtb.r.231203.8:18,at best,,,Extent,,Extent,,,,"They must also get something to keep take - out warm , so it 's not room temperature |at| |best| when you get it home ."
ewtb.r.323449.4:4,at best,,,Extent,,Extent,,,,This place is marginal |at| |best| .
ewtb.r.338429.19:7,at best,,,Extent,,Extent,,,,Gates worked 30 % of the time |at| |best| .
ewtb.r.351727.3:4,at best,,,Extent,,Extent,,,,"The food is mediocre |at| |best| , and largely overpriced given the portion size and quality ."
ewtb.r.030126.6:4,at best,,,Value,,Extent,,,,"The education is horrible |at| |best| , do society a favor , and do NOT send your student here ."
ewtb.r.257296.4:8,at least,,,Extent,,Extent,,,,Come back and give HCC a second chance |at| |least| !
ewtb.r.288100.4:41,at least,,,Extent,,Extent,,,,"It took them nearly two months to complete a simple task , and countless calls from my part due to their lack of response and passion ( not that it 's a requirement for the job , but it helps to |at| |least| pretend to be helpful ) ."
ewtb.r.290594.13:23,at least,,,Extent,,Extent,,,,"My dogs are far from perfect , and one of them I believe would be a little much for daycare here herself ( |at| |least| initially ) ."
ewtb.r.345182.14:12,at least,,,Extent,,Extent,,,,I said I was going to trash it also and could I |at| |least| have a credit .
ewtb.r.063549.5:4,beyond,,,Scalar/Rank,,Extent,,,,The waiting staff is |beyond| impeccable ( they refold your napkin when you go to the bathroom ) .
ewtb.r.053248.16:16,by any stretch of the imagination,,,Extent,,Extent,,,,"The warm chocolate cake was very tasty , but served at room temperature , not warm |by| |any| |stretch| |of| |the| |imagination| ."
ewtb.r.009596.2:3,by far,,,Extent,,Extent,,,,This store is |by| |far| the worst Verizon store I 've been in .
ewtb.r.022461.2:16,by far,,,Extent,,Extent,,,,I 've been to quite a few tattoo shops around this area and Stainless Steel is |by| |far| the best .
ewtb.r.042416.2:2,by far,,,Extent,,Extent,,,,This is |by| |far| the BEST B&B that we have ever stayed at !
ewtb.r.087176.2:2,by far,,,Extent,,Extent,,,,"They are |by| |far| the best salon in 50 miles , Trust me I know !!"
ewtb.r.227515.3:13,by far,,,Extent,,Extent,,,,"I have had several dentists in my life , but Dr. Deters is |by| |far| my favorite ."
ewtb.r.228944.2:3,by far,,,Extent,,Extent,,,,This shop is |by| |far| the best I have been to .
ewtb.r.235423.2:2,by far,,,Extent,,Extent,,,,This is |by| |far| the worst chinese food I have ever had .
ewtb.r.307250.2:3,by far,,,Extent,,Extent,,,,Worst buffet period |by| |far| .
ewtb.r.369608.3:2,by far,,,Extent,,Extent,,,,This is |by| |far| the best run dealership in Miami .
ewtb.r.231203.5:9,for the most part,,,Extent,,Extent,,,,In my experience the food has been excellent ( |for| |the| |most| |part| ) .
ewtb.r.042416.5:4,in every way,,,Manner,,Extent,,,,"The weekend was perfect |in| |every| |way| , in large part to Sue and her great staff ."
ewtb.r.042416.5:8,in large part,,,Extent,,Extent,,,,"The weekend was perfect in every way , |in| |large| |part| to Sue and her great staff ."
ewtb.r.369210.3:5,of,,,Quantity,,Extent,,,,Bramen Honda was a bit |of| a hassle .
ewtb.r.115653.4:6,to,,,EndState,,Extent,,,,I was experiencing severe back pain |to| the point I could barely walk or even bare to sit .
ewtb.r.165143.2:29,to death,,,Extent,,Extent,,,,"First , let me state that although I live in NYC , I am not from NYC , I do n't care about baseball and I absolutely love Boston |to| |death| ( so beautiful , so clean , so awesome ) ."
ewtb.r.365154.7:5,like,,,Comparison/Contrast,FeelsLikeDesire,FEEL_LIKE,,,,"The next time you feel |like| being condescending to someone , it is not going to be me !!!!!!"
ewtb.r.125629.2:6,at,,,Frequency,,Frequency,,,,And they seem to be posted |at| fairly regular intervals ?
ewtb.r.086839.7:1,for,,,Frequency,for Nth time,Frequency,,,,"So |for| the 4th time in 5 months and the third time in 2 weeks , we brought the car back again ."
ewtb.r.114849.1:3,for,,,Frequency,for Nth time,Frequency,,,,"Used their service |for| the first time and was immediately impressed by their professionalism ( received a phone call soon after order was placed to confirm details ) and the subsequent delivery of my gift ( To Split , Croatia ) was as requested ."
ewtb.r.345455.2:7,for,,,Frequency,for Nth time,Frequency,,,,My daughter is starting ballet this year |for| the first time .
ewtb.r.376320.4:15,for,,,Frequency,for Nth time,Frequency,,,,This can tend to be a stressful experience in itself let alone adding crossing boarders |for| the first time .
ewtb.r.187875.3:11,over,,,Frequency,,Frequency,,,,"You charge SO MUCH , yet you use the same grounds |over| and over again ."
ewtb.r.187875.3:13,over,,,Frequency,,Frequency,,,,"You charge SO MUCH , yet you use the same grounds over and |over| again ."
ewtb.r.345455.5:2,at,,,ProfessionalAspect,EmployerAsLocation,Gestalt,Locus,,,The service |at| Instep was great !!
ewtb.r.026883.13:3,at,,,Location,,Gestalt,Locus,,,The customer service |at| Home Delivery Service was terrible let alone their promise to proper set up furniture .
ewtb.r.074896.5:20,on,,,Location,,Gestalt,Locus,,,"I came in for alterations ( free , by the way ) and told her about a stain I had |on| my new leather purse ."
ewtb.r.005760.4:4,of,,,Possessor,AttributeHolder,Gestalt,Possessor,,,Expensive for the level |of| food and the quality of service .
ewtb.r.005760.4:9,of,,,Possessor,AttributeHolder,Gestalt,Possessor,,,Expensive for the level of food and the quality |of| service .
ewtb.r.018548.14:10,of,,,Possessor,AttributeHolder,Gestalt,Possessor,,,"Perhaps they do n't deliver anymore , but the deliciousness |of| a mezza luna certainly warrants a pickup ."
ewtb.r.020992.10:16,of,,,Possessor,AttributeHolder,Gestalt,Possessor,,,"This little drip offered no apologies whatsoever , and even refused to give me the name |of| the manager until I pressed him for it 3 times ."
ewtb.r.030126.4:19,of,,,Possessor,AttributeHolder,Gestalt,Possessor,,,"There 's holes everywhere in the ceiling , sewage constantly leaks through the ceiling , and the whole condition |of| the school is horrible ."
ewtb.r.034501.3:8,of,,,Possessor,AttributeHolder,Gestalt,Possessor,,,It is right on the hustle and bustle |of| Wisconsin Ave but some might miss it as it is nestled in between Subway Sandwiches and Modell 's .
ewtb.r.035726.2:13,of,,,Possessor,AttributeHolder,Gestalt,Possessor,,,Dr. Aster and her team have been a strong advocate in the health |of| both my daughters .
ewtb.r.038523.2:4,of,,,Possessor,AttributeHolder,Gestalt,Possessor,,,Attentive to the needs |of| customer .
ewtb.r.047762.7:4,of,,,Possessor,AttributeHolder,Gestalt,Possessor,,,We prefer the layout |of| rooms and it is always clean .
ewtb.r.060396.1:17,of,,,Possessor,AttributeHolder,Gestalt,Possessor,,,"The best Thai food I 've ever had in Australia , very fresh and so much favor |of| authentic Thai ."
ewtb.r.071518.5:9,of,,,Possessor,AttributeHolder,Gestalt,Possessor,,,I was so impressed with the honesty and integrity |of| Mike and everyone at Eagle Transmission !
ewtb.r.072507.2:20,of,,,Possessor,AttributeHolder,Gestalt,Possessor,,,"Also , he loves teaching so much , his price is unbeatable , but that does not change his level |of| skill ."
ewtb.r.079007.3:1,of,,,Possessor,AttributeHolder,Gestalt,Possessor,,,Attitude |of| staff very bad .
ewtb.r.085980.2:14,of,,,Possessor,AttributeHolder,Gestalt,Possessor,,,"We were disappointed with this holiday dinner due to the overall flavor and price |of| the meal , and accessibility to the Jazz Club ."
ewtb.r.094621.4:23,of,,,Possessor,AttributeHolder,Gestalt,Possessor,,,The second vendor charged $ 55 ( less than half of what A&E charges ) to come and applied that to the price |of| the repair service ( which A&E does not ) .
ewtb.r.094621.5:8,of,,,Possessor,AttributeHolder,Gestalt,Possessor,,,Their quote came in at half the price |of| A&E for the same work and same part .
ewtb.r.094621.7:19,of,,,Possessor,AttributeHolder,Gestalt,Possessor,,,"Very disappointed in Kitchen Aid as well , I thought that they pre-screened their vendors for price and quality |of| work , obviously they do not !"
ewtb.r.110441.13:6,of,,,Possessor,AttributeHolder,Gestalt,Possessor,,,I have to say the value |of| this place always amazes me .
ewtb.r.116821.15:12,of,,,Possessor,AttributeHolder,Gestalt,Possessor,,,"They might want to change the name to reflect the new yorkedness |of| the pizza , scrummy yummy sounds gimmicky to me ."
ewtb.r.122564.4:2,of,,,Possessor,AttributeHolder,Gestalt,Possessor,,,"the attitude |of| some staff is terrible , did not solve anything only say i can do nothing ."
ewtb.r.124163.5:23,of,,,Possessor,AttributeHolder,Gestalt,Possessor,,,"In addition to the core treatment , Dr Nelson has impressed me further with his concern and interest in the well - being |of| his patients - his dental work underpinned by a strong duty of care to every patient ."
ewtb.r.126171.4:11,of,,,Possessor,AttributeHolder,Gestalt,Possessor,,,"Never miss an appointment because they will charge you the price |of| a treatment , even if you had an emergency ."
ewtb.r.134622.2:27,of,,,Possessor,AttributeHolder,Gestalt,Possessor,,,"From the amount of time spent with us to explain things during the initial quote , to the communication through the approval process to the actual workmanship |of| the build itself ."
ewtb.r.135010.4:7,of,,,Possessor,AttributeHolder,Gestalt,Possessor,,,Only if it is of the quality |of| That 's Amore .
ewtb.r.142081.4:11,of,,,Possessor,AttributeHolder,Gestalt,Possessor,,,It also came with free balance and rotation for the life |of| the tires !
ewtb.r.148971.2:7,of,,,Possessor,AttributeHolder,Gestalt,Possessor,,,"I am not sure about the quality |of| the other doctors there , but i do know from personal experience that Dr. Christopher T. Strzalka is not a man of his word , and is also very CRUEL AND UNCARING !!"
ewtb.r.154157.3:8,of,,,Possessor,AttributeHolder,Gestalt,Possessor,,,"He was less than half of the price |of| the cheapest quote we got , and his work was top notch ."
ewtb.r.159371.6:13,of,,,Possessor,AttributeHolder,Gestalt,Possessor,,,but sice we almost just slept there i ca nt give that good |of| a review
ewtb.r.164805.6:15,of,,,Possessor,AttributeHolder,Gestalt,Possessor,,,I loved the car so we began negotiating my trade - in and the price |of| the 09 XF .
ewtb.r.165018.7:17,of,,,Possessor,AttributeHolder,Gestalt,Possessor,,,There was not one ounce of caring involved and anyone I can warn about the complete lack |of| service will be warned .
ewtb.r.181748.11:43,of,,,Possessor,AttributeHolder,Gestalt,Possessor,,,"I mean , I do n't care if he does n't know , but if he pretends to know and tells me BS to my face , there 's no way I 'm going to trust him when matters turn to the price |of| the car and financing ."
ewtb.r.181748.8:10,of,,,Possessor,AttributeHolder,Gestalt,Possessor,,,"After that , I just tried to ignore his lack |of| professionalism and test drive the car ."
ewtb.r.192737.2:20,of,,,Possessor,AttributeHolder,Gestalt,Possessor,,,"Nigel from Nidd Design has always provided a first class service , from his advice and professionalism to the quality |of| his design drawings and planning applications ."
ewtb.r.211797.14:10,of,,,Possessor,AttributeHolder,Gestalt,Possessor,,,"Somehow , since she supposedly does n't know any names |of| designers / dresses , after I told her the designer and dress name of the one I was comparing , she knew "" exactly which dress "" I was referring to and disagreed with my observation ; she said that the bodice did come as low as the one I had on ."
ewtb.r.211797.14:24,of,,,Possessor,AttributeHolder,Gestalt,Possessor,,,"Somehow , since she supposedly does n't know any names of designers / dresses , after I told her the designer and dress name |of| the one I was comparing , she knew "" exactly which dress "" I was referring to and disagreed with my observation ; she said that the bodice did come as low as the one I had on ."
ewtb.r.235423.15:13,of,,,Possessor,AttributeHolder,Gestalt,Possessor,,,Lucky Panda in Willis is a billion times better in service and quality |of| the meal .
ewtb.r.248124.3:9,of,,,Possessor,AttributeHolder,Gestalt,Possessor,,,It is the attention to detail and the quality |of| the work taught at TomiPilates that sets this studio apart from the others .
ewtb.r.260640.6:2,OF,,,Possessor,AttributeHolder,Gestalt,Possessor,,,REAL CHRISTIAN |OF| YOU !!!!!!!!!!!!!!!!!!
ewtb.r.280340.6:13,of,,,Possessor,AttributeHolder,Gestalt,Possessor,,,The portions were generous and we got out for less than the cost |of| one entree at some chain restaurant .
ewtb.r.280663.7:11,of,,,Possessor,AttributeHolder,Gestalt,Possessor,,,Having a team was the best because they kept the flow |of| the wedding going the whole time !
ewtb.r.288100.2:17,of,,,Possessor,AttributeHolder,Gestalt,Possessor,,,"I began seeing Dr. Romanick back in 2000 and have seen a significant decline in the quality |of| care , patient - doctor communication , and just the overall level of services ."
ewtb.r.288100.2:30,of,,,Possessor,AttributeHolder,Gestalt,Possessor,,,"I began seeing Dr. Romanick back in 2000 and have seen a significant decline in the quality of care , patient - doctor communication , and just the overall level |of| services ."
ewtb.r.290594.9:35,of,,,Possessor,AttributeHolder,Gestalt,Possessor,,,"You say you work a lot , and that you have a young dog ; so I have little doubt that your dog is just filled with energy to burn ; and it is good |of| you to look for a place to take him ."
ewtb.r.294081.14:10,OF,,,Possessor,AttributeHolder,Gestalt,Possessor,,,IN MY OPINION SHOULD OF JUST TOOK OFF THE PRICE |OF| THE WINGS FROM THE BILL .
ewtb.r.319816.29:16,of,,,Possessor,AttributeHolder,Gestalt,Possessor,,,I will never return there again ( and now have some serious doubts about the quality |of| work they actually performed on my car ) .
ewtb.r.323248.2:1,of,,,Possessor,AttributeHolder,Gestalt,Possessor,,,Quality |of| work is sufficient but not outstanding .
ewtb.r.323449.6:11,of,,,Possessor,AttributeHolder,Gestalt,Possessor,,,"I was not impressed , and quite frustrated at their lack |of| rating for their courses ."
ewtb.r.323449.7:30,of,,,Possessor,AttributeHolder,Gestalt,Possessor,,,"I understand not wanting to put labels like 5.10 on an indoor course , because yes , it is not the same , but some clear understanding of the difficulty |of| one course to another is nice when you are an intermediate climber looking to improve ."
ewtb.r.329991.3:24,of,,,Possessor,AttributeHolder,Gestalt,Possessor,,,"I was very happy with the customer service and even more please with the portion size , to go box set up and quality |of| the food for the price ."
ewtb.r.333672.3:9,of,,,Possessor,AttributeHolder,Gestalt,Possessor,,,The sales men were very knowledgeable about every aspect |of| every car we looked at .
ewtb.r.360937.2:10,of,,,Possessor,AttributeHolder,Gestalt,Possessor,,,"I must say , I was impressed with the size |of| the bar area and lounge , & I liked that you could see the brewery right thru the glass !"
ewtb.r.364454.5:13,of,,,Possessor,AttributeHolder,Gestalt,Possessor,,,"Based on the test results , the home inspector stated that the quality |of| their job was "" excellent "" ."
ewtb.r.369087.7:12,of,,,Possessor,AttributeHolder,Gestalt,Possessor,,,The advisor kept me up to date and informed on the progress |of| my vehicle .
ewtb.r.376320.8:16,of,,,Possessor,AttributeHolder,Gestalt,Possessor,,,I completely enjoyed my whole check in experience and was impressed with the friendliness and professionalism |of| the staff as well as the accommodations themselves .
ewtb.r.377347.9:17,of,,,Possessor,AttributeHolder,Gestalt,Possessor,,,I really enjoyed meeting her and happy to learn she comes from Oklahoma and has the values |of| a solid no bs country girl .
ewtb.r.247226.9:22,of,,,Possessor,inverse Manner,Gestalt,Possessor,,,Beware of the nail program you are not taught to use a nail drill AT ALL you learn the old fashioned way |of| doing nails you will not be able to do well in a salon !!!
ewtb.r.328828.6:5,of,,,Possessor,inverse Purpose,Gestalt,Possessor,,,So what was the point |of| the appointment !?!
ewtb.r.059088.3:14,of,,,Possessor,inverse Time,Gestalt,Possessor,,,If you mention the name Amir you will receive % 10 off at time |of| purchase
ewtb.r.215460.2:6,of,,,Possessor,inverse Time,Gestalt,Possessor,,,"Hopless service , at the time |of| booking my car a lot was promised but delivered not even one tenth of what was promised ."
ewtb.r.308387.3:25,OF,,,Possessor,inverse Time,Gestalt,Possessor,,,"PLEASE DO N'T USE THIS MOVING COMPANY IF YOU DO N'T WANT TO : CRY , HAVE TROUBLE AND A BAD EXPERIENCE ON THE DAY |OF| YOUR MOVE ."
ewtb.r.308387.4:14,OF,,,Possessor,inverse Time,Gestalt,Possessor,,,"THEY WILL GIVE YOU A LOW PRICE OVER THE PHONE AND ON THE DAY |OF| YOUR MOVE THEY WILL CHANGE THE PRICE , I GUARANTEE IT ."
ewtb.r.288894.2:3,for,,,Purpose,,Gestalt,Purpose,ewtb.r.288894.2:3,Gestalt ~> Purpose,The address is |for| Noida Location not for Gurgaon Location .
ewtb.r.288894.2:7,for,,,Purpose,,Gestalt,Purpose,ewtb.r.288894.2:7,Gestalt ~> Purpose,The address is for Noida Location not |for| Gurgaon Location .
ewtb.r.164580.4:6,from,,,Source,value FROM,Gestalt,Source,,,The best value I 've found |from| a Chinese restaurant .
ewtb.r.220214.12:10,about,,,Possessor,AttributeHolder,Gestalt,Topic,,,They do n't do certain things that are really annoying |about| other offices .
ewtb.r.217747.3:3,about,,,Possessor,,Gestalt,Topic,,,We love everything |about| the fence .
